{
  "$schema": "http://json-schema.org/draft-07/schema#",
  "title": "CodeNook task state.json (M4)",
  "type": "object",
  "additionalProperties": false,
  "required": ["schema_version", "task_id", "plugin", "phase", "iteration",
               "max_iterations", "status", "history"],
  "properties": {
    "schema_version": {"type": "integer", "minimum": 1},
    "task_id": {"type": "string"},
    "title": {"type": "string"},
    "summary": {"type": "string"},
    "plugin": {"type": "string"},
    "plugin_version": {"type": "string"},
    "target_dir": {"type": "string"},
    "target_backend": {
      "type": "string",
      "description": "v0.29.26 — target directory backend. Missing/null in legacy states means local. Current built-ins support local and ssh."
    },
    "target_uri": {
      "type": ["string", "null"],
      "description": "v0.29.26 — canonical target URI for non-local targets, e.g. ssh://user@host:22/abs/path."
    },
    "target_details": {
      "type": "object",
      "additionalProperties": true,
      "description": "v0.29.26 — backend-specific connection/display metadata surfaced to tick envelopes. Must not contain secrets."
    },
    "phase": {"type": ["string", "null"]},
    "phase_started_at": {"type": ["string", "null"]},
    "iteration": {"type": "integer", "minimum": 0},
    "max_iterations": {"type": "integer", "minimum": 0},
    "dual_mode": {"enum": ["serial", "parallel"]},
    "priority": {"enum": ["P0", "P1", "P2", "P3"]},
    "status": {"enum": ["pending", "in_progress", "waiting", "blocked", "done",
                         "cancelled", "error"]},
    "subtasks": {"type": "array", "items": {"type": "string"}},
    "depends_on": {"type": "array", "items": {"type": "string"}},
    "decomposed": {"type": "boolean"},
    "config_overrides": {"type": "object"},
    "task_type": {
      "type": ["string", "null"],
      "description": "Profile selector for profile-aware plugins (e.g. development v0.2.0). Set by clarifier output frontmatter; null/missing means the plugin's default profile is used."
    },
    "profile": {
      "type": ["string", "null"],
      "description": "Resolved profile name (cached by orchestrator-tick after the first dispatch). Internal."
    },
    "custom_phase_chain": {
      "type": "array",
      "items": {"type": "string"},
      "description": "Wizard / --phase-chain composer override. When non-empty, orchestrator-tick bypasses profile resolution and walks exactly these phase ids in order. Set once at task creation; never re-cached."
    },
    "selected_plugins": {
      "type": "array",
      "items": {"type": "string"}
    },
    "role_constraints": {
      "type": "object",
      "additionalProperties": false,
      "properties": {
        "excluded": {
          "type": "array",
          "items": {
            "type": "object",
            "additionalProperties": false,
            "required": ["plugin", "role"],
            "properties": {
              "plugin": {"type": "string"},
              "role": {"type": "string"}
            }
          }
        },
        "included": {
          "type": "array",
          "items": {
            "type": "object",
            "additionalProperties": false,
            "required": ["plugin", "role"],
            "properties": {
              "plugin": {"type": "string"},
              "role": {"type": "string"}
            }
          }
        }
      }
    },
    "in_flight_agent": {
      "type": ["object", "null"],
      "additionalProperties": false,
      "required": ["agent_id", "role", "dispatched_at", "expected_output"],
      "properties": {
        "agent_id": {
          "type": ["string", "array"],
          "items": {"type": "string"}
        },
        "role": {"type": "string"},
        "dispatched_at": {"type": "string"},
        "expected_output": {"type": "string"}
      }
    },
    "history": {
      "type": "array",
      "items": {
        "type": "object",
        "additionalProperties": false,
        "required": ["ts", "phase"],
        "properties": {
          "ts": {"type": "string"},
          "phase": {"type": "string"},
          "verdict": {"type": "string"},
          "_warning": {"type": "string"}
        }
      }
    },
    "created_at": {"type": "string"},
    "updated_at": {"type": "string"},
    "current_focus": {"type": "string"},
    "last_tick_ts": {"type": "string"},
    "parent_id": {
      "type": ["string", "null"],
      "description": "M10 task-chain link: user-confirmed parent task in the same workspace; null = independent."
    },
    "chain_root": {
      "type": ["string", "null"],
      "description": "M10 cached terminal ancestor of the chain (O(1) root lookup); MUST equal walk_ancestors(...).last when parent_id != null, else null."
    },
    "model_override": {
      "type": ["string", "null"],
      "description": "v0.18 — per-task LLM model override. Highest-priority layer in the C/B/A/D resolution chain (task > phase > plugin > workspace). Opaque string forwarded verbatim to the conductor."
    },
    "execution_mode": {
      "type": ["string", "null"],
      "enum": ["sub-agent", "inline", null],
      "description": "v0.19 — per-task execution dispatch mode. 'sub-agent' (default) emits phase_prompt envelopes; 'inline' emits inline_dispatch envelopes that the conductor handles in-process. Absence ⇒ default 'sub-agent'."
    },
    "hitl_decider": {
      "type": ["string", "null"],
      "enum": ["human", "main-session-llm", null],
      "description": "v0.30 — per-task HITL decision authority. Absence/null means human approval via ask_user. 'main-session-llm' delegates gate decisions to the conductor's main-session LLM, which must read the gate/output and submit codenook decide without asking a human."
    },
    "task_input": {
      "type": ["string", "null"],
      "description": "v0.20 — initial task seed text supplied via `task new --input` / `--input-file` / `--interactive`. Surfaced verbatim in the tick dispatch envelope under the same key so phase agents and the inline conductor can use it."
    },
    "entry_answers": {
      "type": "object",
      "additionalProperties": true,
      "description": "v0.29.3 — plugin-defined entry-question answers. Keys correspond to fields declared in `plugins/<id>/entry-questions.yaml :: <phase>.required`. Populated via `codenook task set --field <key> --value <answer>` when the field is not in the kernel's reserved writable allow-list. Read by `check_entry_questions()` (with top-level fallback for back-compat)."
    }
  }
}
